{"run":39,"commit":"e26780e","metric":86,"metrics":{},"status":"discard","description":"Second confidence rerun of the tightened R4 recipe returned to the fast regime, indicating the prior 184.5 result was dominated by an R2 outlier rather than disproving the change.","timestamp":1776563343836,"segment":6,"confidence":2.9213483146067416,"iterationTokens":4624,"asi":{"hypothesis":"If the R4 recipe note is genuinely helping, an additional rerun should snap back toward the earlier 84 result rather than consistently reproducing the 184.5 outlier.","rollback_reason":"No new code was introduced in this rerun; it only increases confidence on the already-kept e26780e branch.","next_action_hint":"Treat e26780e as the current best branch. Update autoresearch.md and prune ideas so future work starts from this branch and only targets fresh generic dead-turn patterns.","secondary_metrics":{"r2_s":40.5,"r4_s":23,"r5_s":22.5,"r3_s":24,"passes":7,"target_passes":6,"avg_turns":3.857,"eff_cost":32797.029},"learned":"The branch again delivered an ~mid-80s total with strong R4 and healthy R2/R5, so the previous slow rerun looks like a noise spike concentrated in one R2 sample rather than a systematic regression from the R4 wording tweak."}}
{"run":40,"commit":"e26780e","metric":97,"metrics":{},"status":"discard","description":"Skill-only R2 note telling the agent to stop after the first 2+ plausible test/spec hits did not beat the current best branch. It kept R4/R5 strong but did not materially improve R2 over e26780e.","timestamp":1776563641788,"segment":6,"confidence":2.9545454545454546,"iterationTokens":3861,"asi":{"hypothesis":"A tiny R2 recipe note discouraging post-search detours into view-structure or extra search-code variants would suppress the occasional R2 spiral without hurting other tasks.","rollback_reason":"This run was slower than the current best e26780e samples (~84-86 total_s), so the added R2 wording does not justify staying in the prompt.","next_action_hint":"Keep e26780e as the best branch. If pursuing R2 further, prefer structural CLI affordances over more prompt wording.","secondary_metrics":{"r2_s":54.5,"r4_s":21,"r5_s":21.5,"r3_s":38,"passes":7,"target_passes":6,"avg_turns":5.429,"eff_cost":37128.029},"learned":"The extra R2 sentence did not collapse R2; instead it landed in a middling regime. That suggests the remaining R2 variance is not solved by one more anti-detour reminder."}}
{"run":41,"commit":"e26780e","metric":85,"metrics":{},"status":"discard","description":"CLI-only metadata tweak: expose resultsSortedBy=mergedAt desc and effectiveLimit on merged search-prs JSON output. The run stayed fast, but it did not clearly beat the current e26780e branch.","timestamp":1776563911735,"segment":6,"confidence":2.9213483146067416,"iterationTokens":8203,"asi":{"hypothesis":"If the agent sometimes re-probes PR result order or applied limit, surfacing those semantics directly in JSON should remove that uncertainty without further prompt changes.","rollback_reason":"The run landed in the same band as the current best (~84-86 total_s), so this metadata addition does not show a clear incremental win over e26780e.","next_action_hint":"Keep e26780e as the best branch. Future work should focus on fresh structural fixes with clearer upside than descriptive metadata.","secondary_metrics":{"r2_s":34,"r4_s":26.5,"r5_s":24.5,"r3_s":26,"passes":7,"target_passes":6,"avg_turns":3.857,"eff_cost":32355.064},"learned":"Surfacing order/limit semantics appears harmless, but the benchmark did not need it enough to produce a measurable gain over the already-tightened skill guidance."}}
{"run":42,"commit":"e26780e","metric":176,"metrics":{},"status":"discard","description":"CLI-only: increased search-code responseCharLength for JSON agent subcommands to surface more hits in one call. This regressed badly on the broad harness, likely by bloating outputs and encouraging longer search detours.","timestamp":1776564437543,"segment":6,"confidence":2.888888888888889,"iterationTokens":8203,"asi":{"hypothesis":"One source of R2 search spirals may be truncated search-code output; giving the agent a larger first search result payload could eliminate follow-up search/view-structure calls.","rollback_reason":"The larger search-code payload made the broad benchmark much worse, with R2 and R4 both regressing substantially, so the extra output is not a good general fix.","next_action_hint":"Avoid bigger search-code payloads. If continuing on R2, prefer changes that reduce ambiguity or process starts without increasing raw output volume.","secondary_metrics":{"r2_s":89,"r4_s":61,"r5_s":26,"r3_s":25,"passes":7,"target_passes":6,"avg_turns":8.286,"eff_cost":52554.686},"learned":"The CLI does not benefit from simply surfacing more search-code output. The agent likely gets overwhelmed or spends more time parsing, so this direction is stale for now."}}
{"run":43,"commit":"e26780e","metric":309,"metrics":{},"status":"checks_failed","description":"CLI+skill: added generic search-code path metadata (isTestLike/isExampleLike) and updated the R2 recipe to use it. This destabilized the broad harness badly, including a slow R4 outlier and an R5 formatting failure.","timestamp":1776565611637,"segment":6,"confidence":2.5,"iterationTokens":4628,"asi":{"hypothesis":"If the agent gets explicit test/example path hints from search-code results, it should avoid R2 search spirals without needing more prompt text or view-structure detours.","rollback_reason":"The change caused a failed broad run with target_passes dropping to 5, plus severe regressions on R4/R5, so this metadata direction is not safe to keep.","next_action_hint":"Revert this idea. Future experiments should avoid adding new search-code metadata that changes model attention; prefer narrower CLI ergonomics or confidence reruns on e26780e.","secondary_metrics":{"r2_s":49,"r4_s":236,"r5_s":24,"r3_s":21,"passes":6,"target_passes":5,"avg_turns":5,"eff_cost":34716.157},"error_details":{"r5_t1":"answer not dict","r4_t1_wall":432},"learned":"Even generic-looking search-code metadata can perturb behavior across unrelated tasks. The current branch is sensitive enough that extra result fields are not a free win."}}
{"run":44,"commit":"e26780e","metric":108.5,"metrics":{},"status":"discard","description":"Confidence rerun on the current best e26780e branch stayed well below the 149 broad-harness baseline, reinforcing that the retained branch is still strong after discarding the stale R2 search-code ideas.","timestamp":1776565895977,"segment":6,"confidence":2.888888888888889,"iterationTokens":2221,"asi":{"hypothesis":"After discarding the failed search-code-output experiments, the retained e26780e branch should continue landing materially below the 149 baseline on the 2-sample broad harness.","rollback_reason":"No new code was introduced in this rerun; it only revalidated the already-kept e26780e branch.","next_action_hint":"Keep e26780e as the best code state. Future work should avoid extra search-code output shaping and instead wait for a narrower, clearly structural CLI ergonomics idea.","secondary_metrics":{"r2_s":39.5,"r4_s":46,"r5_s":23,"r3_s":22,"passes":7,"target_passes":6,"avg_turns":5.286,"eff_cost":37962.971},"learned":"Even after two stale R2 experiments were rejected, the retained branch remains comfortably faster than the 149 baseline. Remaining variance is still mostly a single noisy R4 sample rather than a systematic collapse."}}
{"run":45,"commit":"e26780e","metric":0,"metrics":{},"status":"crash","description":"CLI-only: added a compatibility alias so githubSearchCode text_matches expose fragment=value when absent. The broad harness timed out during the first R2 sample, so this perturbation is not safe.","timestamp":1776568093828,"segment":6,"confidence":2.888888888888889,"iterationTokens":3309,"asi":{"hypothesis":"Some R2 retries may happen because the model expects .text_matches[].fragment while the CLI currently exposes .value. Adding a fragment alias could let first-pass jq extracts succeed and cut repeated search-code calls.","rollback_reason":"The experiment timed out before finishing the broad harness, with R2 rep 1 alone taking 443s. This change is too destabilizing to keep.","next_action_hint":"Avoid modifying search-code result shape further. Re-center on the retained e26780e branch and prefer either confidence reruns or a completely different narrow ergonomics idea.","error_details":{"timeout_seconds":1200,"observed_partial":"trial task=R2 rep=1 rc=0 wall=443s"},"learned":"Even a small compatibility alias on search-code result items can materially perturb model behavior. Search-code result-shape changes are now a high-risk area."}}
{"run":46,"commit":"e26780e","metric":0,"metrics":{},"status":"crash","description":"Confidence rerun on the retained e26780e branch timed out before the broad harness completed, so this sample is unusable and mainly reinforces that the harness still has occasional long-tail stalls.","timestamp":1776569333111,"segment":6,"confidence":2.888888888888889,"iterationTokens":1558,"asi":{"hypothesis":"A confidence rerun should finish and land somewhere in the known e26780e distribution if the harness is behaving normally.","rollback_reason":"The benchmark run timed out before reporting metrics, so there is no valid new measurement to keep.","next_action_hint":"Treat this as harness noise, not evidence against e26780e. If more confidence is needed later, rerun with a longer timeout rather than changing product code.","error_details":{"timeout_seconds":1200},"learned":"Even on the retained best branch, the broad harness can still stall long enough to hit the outer timeout. Confidence reruns should be infrequent and may need a longer budget."}}
{"run":47,"commit":"e26780e","metric":507,"metrics":{},"status":"discard","description":"Long-timeout confidence rerun on e26780e completed but landed in a severe outlier regime, dominated by one extremely slow R2 sample and the known flaky R3 guardrail failure. This reinforces that the harness has heavy-tailed noise.","timestamp":1776570617007,"segment":6,"confidence":2.5,"iterationTokens":949,"asi":{"hypothesis":"Giving the harness a longer outer timeout should convert timeout crashes into usable confidence samples on the retained branch.","rollback_reason":"No new code was introduced, and this run is far worse than the known e26780e distribution due to runtime noise/outliers rather than a product regression.","next_action_hint":"Do not spend more session budget on confidence reruns. Treat e26780e as the best retained branch and wait for a clearly new structural idea before resuming product experimentation.","secondary_metrics":{"r2_s":336,"r4_s":118.5,"r5_s":52.5,"r3_s":999,"passes":6,"target_passes":6,"avg_turns":4.143,"eff_cost":33407.786},"error_details":{"r3":"entryPoint file not found: src/mcp/server/fastmcp/server.py","r2_t1_wall":640},"learned":"A longer timeout converts some stalls into completed measurements, but the resulting sample can still be dominated by extreme runtime variance. Additional confidence reruns are currently low leverage."}}
{"run":48,"commit":"e26780e","metric":94.5,"metrics":{},"status":"discard","description":"Skill-only: clarified that search-code snippet text lives at .text_matches[].value and that the agent should not assume .fragment. This was safe but did not beat the current best branch.","timestamp":1776570933311,"segment":6,"confidence":2.888888888888889,"iterationTokens":6189,"asi":{"hypothesis":"Some R2 detours may come from the model guessing a .text_matches[].fragment field; a minimal skill note pointing it to .value could reduce retries without touching search-code output.","rollback_reason":"The run stayed respectable but did not improve on the current e26780e branch, especially on R2, so the extra wording is not worth keeping.","next_action_hint":"Keep e26780e as the best branch. If continuing, look for a fresh narrow ergonomics idea outside both search-code output shaping and more JSON-field reminder text.","secondary_metrics":{"r2_s":49.5,"r4_s":17,"r5_s":28,"r3_s":22,"passes":7,"target_passes":6,"avg_turns":4.571,"eff_cost":35436.643},"learned":"The .value clarification is harmless and R4 stayed excellent, but it did not materially collapse R2. Remaining R2 variance likely needs something more structural than one more field-name reminder."}}
{"run":49,"commit":"e26780e","metric":99.5,"metrics":{},"status":"discard","description":"CLI-only discoverability tweak: search-prs help text now advertises merged mode and the fact that results already include number/title/mergedAt/fileChanges. It was safe but did not beat the current best branch.","timestamp":1776571450319,"segment":6,"confidence":2.9213483146067416,"iterationTokens":2057,"asi":{"hypothesis":"If the model underuses search-prs for PR archaeology, a tiny help/spec wording change that makes merged-fileChanges affordances more obvious could reduce follow-up confirmation detours.","rollback_reason":"The run stayed decent overall but did not improve on the retained e26780e branch, especially on R2, so this discoverability tweak is not worth keeping.","next_action_hint":"Treat extra R4 help/prompt wording churn as low leverage for now. Wait for a genuinely new structural ergonomics idea rather than more instruction polish.","secondary_metrics":{"r2_s":53.5,"r4_s":23.5,"r5_s":22.5,"r3_s":26,"passes":7,"target_passes":6,"avg_turns":4.143,"eff_cost":34674.657},"learned":"Making merged PR affordances more explicit in the command spec is harmless and keeps R4 fast, but it does not unlock a new overall improvement beyond the existing skill guidance."}}
{"run":50,"commit":"e26780e","metric":103,"metrics":{},"status":"discard","description":"Skill-only: added a general rule to use search-code for candidate paths only and switch to get-file --match-string for exact evidence instead of probing nested text_matches internals. This was safe but did not beat the current best branch.","timestamp":1776571777731,"segment":6,"confidence":2.9545454545454546,"iterationTokens":4736,"asi":{"hypothesis":"Some R2 retries come from the model trying to parse nested search-code text_matches fields. Steering it to treat search-code as a path-finder and get-file as the evidence source could remove those detours without changing CLI output.","rollback_reason":"The run stayed healthy but did not improve on the retained e26780e branch, so this additional guidance is not worth keeping.","next_action_hint":"Keep e26780e as the best branch. More search-code-related wording tweaks look low leverage; wait for a different structural ergonomics idea.","secondary_metrics":{"r2_s":39,"r4_s":40.5,"r5_s":23.5,"r3_s":27,"passes":7,"target_passes":6,"avg_turns":4.857,"eff_cost":38460.729},"learned":"The rule is directionally sane and R2 stayed fine, but it did not produce a new overall win. Search-code detours may now be mostly harness noise rather than something one more skill sentence can eliminate."}}
{"run":51,"commit":"e26780e","metric":99.5,"metrics":{},"status":"discard","description":"CLI-only: clamp search-code --limit to 20 on the agent subcommand, mirroring the earlier search-prs bound handling. This was safe but did not beat the current best branch.","timestamp":1776572035740,"segment":6,"confidence":3.611111111111111,"iterationTokens":2448,"asi":{"hypothesis":"The model often asks search-code for 30 results even though the skill says one broad query should stay under ~20 hits. Clamping agent-subcommand search-code limits to 20 might reduce output/parse cost and suppress some R2 fan-out without changing result shape.","rollback_reason":"The run stayed decent overall but did not improve on the retained e26780e branch, so this bound change is not worth keeping.","next_action_hint":"Keep e26780e as the best branch. Search-code limit clamping now also looks low leverage; wait for a different structural ergonomics idea.","secondary_metrics":{"r2_s":48.5,"r4_s":27.5,"r5_s":23.5,"r3_s":21,"passes":7,"target_passes":6,"avg_turns":4.714,"eff_cost":37681.129},"learned":"Unlike search-prs, clamping search-code limits did not unlock a new win. The remaining overhead is probably not explained primarily by asking for 30 vs 20 code results."}}
{"run":52,"commit":"e26780e","metric":106,"metrics":{},"status":"discard","description":"CLI-only: clamp view-structure depth to 3 on the agent subcommand to prevent overly deep whole-repo tree dumps. This was safe but did not beat the current best branch.","timestamp":1776572417986,"segment":6,"confidence":4.814814814814815,"iterationTokens":7949,"asi":{"hypothesis":"Some R2 detours come from the model requesting very deep whole-repo view-structure scans (e.g. depth 4) after an imperfect search-code pass. Clamping view-structure depth could reduce output and parse cost without changing result shape.","rollback_reason":"The run stayed healthy overall but did not improve on the retained e26780e branch, so this depth clamp is not worth keeping.","next_action_hint":"If view-structure is still worth exploring, only try one tighter variant before treating this clamp family as stale. Otherwise wait for a different structural ergonomics idea.","secondary_metrics":{"r2_s":46.5,"r4_s":38,"r5_s":21.5,"r3_s":23,"passes":7,"target_passes":6,"avg_turns":4.571,"eff_cost":39221.486},"learned":"Reducing deep tree scans is directionally reasonable, but a max depth of 3 did not unlock a new overall improvement. The remaining overhead is likely not dominated by just one extra depth level."}}
{"run":53,"commit":"e26780e","metric":120.5,"metrics":{},"status":"discard","description":"CLI-only: clamp view-structure depth to 2 on the agent subcommand. This was worse than the depth-3 variant and clearly did not beat the current best branch.","timestamp":1776572724642,"segment":6,"confidence":4.7272727272727275,"iterationTokens":2377,"asi":{"hypothesis":"If deep whole-repo structure scans are a real source of R2 overhead, a stricter cap of 2 should help more than a cap of 3 while still preserving enough directory context.","rollback_reason":"The stricter cap regressed the broad harness, especially on R4, so the view-structure depth clamp family is not worth keeping.","next_action_hint":"Prune view-structure depth clamps as stale and wait for a different narrow structural idea outside search-code shaping, wording churn, or tree-depth limits.","secondary_metrics":{"r2_s":42,"r4_s":56,"r5_s":22.5,"r3_s":26,"passes":7,"target_passes":6,"avg_turns":5.286,"eff_cost":40423.764},"learned":"Depth clamping is not the missing lever. A tighter cap made things worse, which suggests the remaining overhead is not solved by simply restricting tree output."}}
{"run":54,"commit":"e26780e","metric":93.5,"metrics":{},"status":"discard","description":"CLI-only: when get-file is used with --match-string and no explicit window, default matchContextLines to 6 on the agent subcommand. This improved R2 materially but still did not beat the current best branch overall.","timestamp":1776572991207,"segment":6,"confidence":4.814814814814815,"iterationTokens":2257,"asi":{"hypothesis":"A lot of get-file --match-string calls are only using matchLine or a tiny snippet, so the default context window may be larger than needed. Supplying a small default window could cut transfer/parse cost without changing result shape.","rollback_reason":"The run was respectable and R2 improved sharply, but total_s still did not beat the retained e26780e branch because R4 landed slower on this sample. Not enough evidence to replace the current best.","next_action_hint":"If this direction is revisited, try at most one tighter context-window variant; otherwise treat get-file default-window tuning as another low-leverage family.","secondary_metrics":{"r2_s":28,"r4_s":43.5,"r5_s":22,"r3_s":27,"passes":7,"target_passes":6,"avg_turns":4.286,"eff_cost":35711.836},"learned":"Defaulting a small matchString context window is a plausible R2 lever. It helped R2 strongly without breaking correctness, but it has not yet shown an overall win on the broad harness."}}
