{"run":2,"commit":"2dc3bed","metric":0,"metrics":{},"status":"crash","description":"Second baseline attempt still failed because one sampled R2 run timed out at the 300s harness alarm, so the 2x-repeat benchmark is too long/noisy for the loop.","timestamp":1776542535652,"segment":0,"confidence":null,"iterationTokens":5811,"asi":{"hypothesis":"A small repeated benchmark subset will be stable enough to compare skill edits while still catching regressions on R2/R4/R5.","rollback_reason":"The current 2x-repeat script is too slow and one R2 run produced no result before the harness alarm, invalidating the metric.","next_action_hint":"Shrink the inner benchmark to one pass each of R2/R4/R5 plus one R3 guardrail so each experiment stays comfortably under the timeout ceiling.","error_detail":"R2 t2 failed with missing result after wall=300s; R3 guardrail remained flaky but non-blocking.","secondary_metrics":{"r2_s":100,"r4_s":83,"r5_s":82.5,"r3_s":999,"passes":5,"target_passes":5,"avg_turns":13,"eff_cost":67005.243}}}
{"run":3,"commit":"a971ca0","metric":370,"metrics":{},"status":"keep","description":"Established a valid fast baseline for the new target with one sampled run each of R2/R4/R5 plus an R3 guardrail; target tasks all passed but R3 remains too flaky to use as a hard gate.","timestamp":1776542974942,"segment":0,"confidence":null,"iterationTokens":1432,"asi":{"hypothesis":"A 4-run CLI-only subset benchmark is fast enough for iterative skill experiments while still reflecting the R2/R4/R5 gap.","secondary_metrics":{"r2_s":179,"r4_s":62,"r5_s":129,"r3_s":999,"passes":3,"target_passes":3,"avg_turns":17.25,"eff_cost":97750.863},"learned":"Current baseline is dominated by R2 and R5. The single-run harness is noisy but practical; use target_passes as the correctness gate and treat R3 as a guardrail signal, not a blocker.","guardrail_note":"R3 scorer/model path remains flaky because python-sdk entrypoint answers vary across acceptable FastMCP paths."}}
{"run":4,"commit":"ee7aa07","metric":253,"metrics":{},"status":"keep","description":"Skill-only: added explicit JSON envelope jq paths, banned schema-probe reruns, discouraged gh fallback, and added concrete R2/R4/R5 recipes. R4 and R5 collapsed hard with far fewer turns.","timestamp":1776543375347,"segment":0,"confidence":null,"iterationTokens":4418,"asi":{"hypothesis":"The main benchmark gap comes from the model wasting turns on envelope discovery and ad-hoc fallback logic; concrete jq paths plus task-shaped recipes should remove that waste.","secondary_metrics":{"r2_s":196,"r4_s":26,"r5_s":31,"r3_s":999,"passes":3,"target_passes":3,"avg_turns":11.5,"eff_cost":72124.312},"learned":"This confirms the diagnosis: guidance, not CLI runtime, was the dominant issue for R4/R5. Average turns fell from 17.25 to 11.5. R2 still remains the stubborn hotspot.","next_action_hint":"Focus next on the R2 library-usage loop specifically: teach the model to choose exactly three candidate test files from the first search and use one match-string read per file, not line-window rereads."}}
{"run":5,"commit":"ee7aa07","metric":0,"metrics":{},"status":"crash","description":"Skill-only follow-up: added stricter 'only octocode-cli, no localhost helper servers' guidance and a more explicit generic R2 batching recipe, but R2 timed out and the benchmark became invalid.","timestamp":1776544089908,"segment":0,"confidence":null,"iterationTokens":5702,"asi":{"hypothesis":"If the model is explicitly forbidden from bootstrapping octocode-research/localhost helpers, it will stick to octocode-cli and cut the remaining R2 overhead.","rollback_reason":"The new wording appears to have confused or over-constrained the R2 flow enough that the task hit the 300s alarm and produced no result.","next_action_hint":"Inspect the timed-out R2 transcript before retrying; likely keep the anti-helper rule but simplify the R2 recipe so it is shorter and less prescriptive.","error_detail":"R2 t1 missing result after wall=301s; R4/R5 still passed.","secondary_metrics":{"r2_s":999,"r4_s":104,"r5_s":61,"r3_s":162,"passes":3,"target_passes":2,"avg_turns":11.75,"eff_cost":76405.15}}}
{"run":6,"commit":"ee7aa07","metric":0,"metrics":{},"status":"crash","description":"Skill-only follow-up: simplified examples and clarified that search-code has snippets not line numbers, but the stronger 'use octocode-cli directly / ignore detours' wording caused both R2 and R5 to time out.","timestamp":1776544884546,"segment":0,"confidence":null,"iterationTokens":7791,"asi":{"hypothesis":"A tighter anti-detour instruction plus a clearer search-code limitation would stop the remaining R2 fallback spiral without hurting the already-good R4/R5 behavior.","rollback_reason":"This wording appears to over-constrain the agent and led to missing results on both R2 and R5 within the 300s alarm.","next_action_hint":"Keep the earlier successful skill as baseline. Next try a narrower edit that targets only R2 decision-making, not a stronger global ban.","error_detail":"R2 and R5 both timed out with missing result; only R4 stayed fast.","secondary_metrics":{"r2_s":999,"r4_s":21,"r5_s":999,"r3_s":91,"passes":2,"target_passes":1,"avg_turns":5.75,"eff_cost":31178.4}}}
{"run":7,"commit":"ee7aa07","metric":276,"metrics":{},"status":"discard","description":"Skill-only: added a very local R2 budget rule (one search, three files, one get-file per file), but the sampled benchmark regressed overall versus the current best.","timestamp":1776545241961,"segment":0,"confidence":11,"iterationTokens":1985,"asi":{"hypothesis":"A lightweight per-task budget reminder inside the R2 section might cut the remaining search/read loop without disturbing the strong R4/R5 gains.","rollback_reason":"Overall total_s regressed from 253s to 276s; R2 barely moved while R4/R5 lost much of the earlier win.","next_action_hint":"Avoid more text-only budget rules. The next promising path is either pruning misleading examples or improving CLI affordances for batched reads.","secondary_metrics":{"r2_s":176,"r4_s":52,"r5_s":48,"r3_s":999,"passes":3,"target_passes":3,"avg_turns":16,"eff_cost":95400.3},"learned":"The model did not internalize the budget rule strongly enough to help R2, but the extra text still added cognitive load elsewhere."}}
{"run":8,"commit":"ee7aa07","metric":266,"metrics":{},"status":"discard","description":"Skill-only: minimally clarified that search-code results do not contain reliable line numbers and trimmed examples to path-only, but the sampled benchmark still underperformed the current best.","timestamp":1776545614867,"segment":0,"confidence":22,"iterationTokens":6275,"asi":{"hypothesis":"The remaining R2 spiral starts when the model assumes search-code exposes line numbers; removing that assumption should keep it on the intended get-file path.","rollback_reason":"Overall total_s regressed from 253s to 266s. R4 improved again, but R5 worsened enough that the total lost ground.","next_action_hint":"Do not keep piling on skill caveats. The best retained change remains the broader jq-path + task recipe edit. Next likely win is a tiny CLI affordance or stronger benchmark harness for R2-specific iteration.","secondary_metrics":{"r2_s":178,"r4_s":21,"r5_s":67,"r3_s":999,"passes":3,"target_passes":3,"avg_turns":15,"eff_cost":86524.65},"learned":"The line-number clarification helps R4/R2 behavior somewhat, but it does not robustly suppress the R5 variance and is not strong enough to beat the current best."}}
{"run":9,"commit":"b107070","metric":156,"metrics":{},"status":"keep","description":"Skill-only: added one top-level instruction that this skill is self-contained and should not invoke Skill(octocode-research) or its helper server unless octocode-cli already failed. This sharply cut R2 and improved every sampled task.","timestamp":1776545974235,"segment":0,"confidence":12,"iterationTokens":1967,"asi":{"hypothesis":"A minimal anti-nested-skill instruction will stop the benchmark agent from escaping into octocode-research helper-server detours while preserving the good jq-path/task-recipe guidance.","secondary_metrics":{"r2_s":70,"r4_s":47,"r5_s":39,"r3_s":66,"passes":4,"target_passes":3,"avg_turns":10.25,"eff_cost":55069.137},"learned":"Nested skill invocation was a major hidden cost center. A single focused sentence worked far better than broader anti-detour wording. R2 dropped from 196s to 70s and even the flaky R3 guardrail passed on this sample.","next_action_hint":"Re-run this exact code once to estimate noise. If it holds up, then try very small follow-ups only around nested-skill avoidance or command-help discoverability, not more broad rules."}}
{"run":10,"commit":"b107070","metric":406,"metrics":{},"status":"discard","description":"Noise-check rerun of the current best self-contained-skill branch; the same code came in much slower, so keep the earlier 156s sample as the retained result and treat this run as high benchmark variance.","timestamp":1776546453110,"segment":0,"confidence":2.6666666666666665,"iterationTokens":1189,"asi":{"hypothesis":"The new self-contained-skill instruction produced a real improvement, but the single-sample benchmark may still have substantial task-level variance.","rollback_reason":"This is the same code state and the rerun was far worse than the best observed 156s sample, so there is no new code to retain separately.","next_action_hint":"Inspect the slow rerun transcripts to see whether nested-skill avoidance held and whether ToolSearch/gh fallback still causes occasional behavioral explosions; target that source of variance next.","secondary_metrics":{"r2_s":133,"r4_s":114,"r5_s":159,"r3_s":999,"passes":3,"target_passes":3,"avg_turns":21,"eff_cost":107719.1},"learned":"Even on the improved branch, sampled task behavior can swing widely. We likely fixed one major failure mode but not all variance sources."}}
{"run":11,"commit":"b107070","metric":273,"metrics":{},"status":"discard","description":"Skill-only follow-up: promoted the anti-nested-skill guidance into a numbered core rule, but the sampled benchmark regressed overall because R2 blew back up.","timestamp":1776546820455,"segment":0,"confidence":7.8,"iterationTokens":5615,"asi":{"hypothesis":"If the anti-octocode-research guidance is placed in the numbered core-discipline section, the model will follow it more reliably than a top-level prose note.","rollback_reason":"Overall total_s regressed from 156s to 273s; R2 rose sharply even though R4/R5 stayed decent.","next_action_hint":"Keep the lighter top-level self-contained note, but do not reinforce it with more rule text. Next inspect whether a tiny CLI/help affordance can reduce the remaining variance without extra prompt load.","secondary_metrics":{"r2_s":209,"r4_s":21,"r5_s":43,"r3_s":54,"passes":4,"target_passes":3,"avg_turns":14.25,"eff_cost":90418.025},"learned":"The stronger placement added cognitive load but did not robustly suppress the bad R2 path. Prompt weight matters nonlinearly here."}}
{"run":12,"commit":"b107070","metric":212,"metrics":{},"status":"discard","description":"Skill-only: combined the self-contained note with lighter search-code examples (path-only plus exact-line handoff reminder), but the sampled benchmark still underperformed the current best branch.","timestamp":1776547229148,"segment":0,"confidence":4.216216216216216,"iterationTokens":4538,"asi":{"hypothesis":"Once nested-skill detours are reduced, removing misleading `text_matches` examples should further suppress the R2 line-number confusion without extra prompt weight.","rollback_reason":"Overall total_s regressed from 156s to 212s; R2 improved relative to some bad samples but not enough to beat the best retained branch.","next_action_hint":"Try reducing prompt weight rather than adding more body text — for example, move the self-contained instruction into frontmatter/description instead of repeating it in the body.","secondary_metrics":{"r2_s":102,"r4_s":50,"r5_s":60,"r3_s":108,"passes":4,"target_passes":3,"avg_turns":15.75,"eff_cost":83231.85},"learned":"The line-number confusion is real, but body-text clarifications alone are not the strongest lever. The anti-nested-skill signal seems more important than path-only examples."}}
{"run":13,"commit":"b107070","metric":365,"metrics":{},"status":"discard","description":"Skill-only: moved the self-contained / no-octocode-research instruction from body text into frontmatter description to reduce prompt weight, but behavior regressed badly on R2.","timestamp":1776547678358,"segment":0,"confidence":2.557377049180328,"iterationTokens":2687,"asi":{"hypothesis":"The anti-nested-skill signal might work better from the skill metadata/description than from extra prose in the body, preserving the win with less prompt weight.","rollback_reason":"Overall total_s regressed from 156s to 365s, with R2 exploding to 282s and 46 turns.","next_action_hint":"Keep the body-level self-contained note; frontmatter-only placement is too weak. Remaining paths likely require either a CLI affordance or a more targeted benchmark harness.","secondary_metrics":{"r2_s":282,"r4_s":43,"r5_s":40,"r3_s":999,"passes":3,"target_passes":3,"avg_turns":19.5,"eff_cost":113806.525},"learned":"The body note is doing real work. Moving it into metadata loses too much prompt salience for the benchmark agent."}}
{"run":14,"commit":"b107070","metric":0,"metrics":{},"status":"crash","description":"CLI-only: added tiny search-code/get-file wording hints to agent command specs, but the sampled benchmark became invalid after R2 hit the 300s alarm and the outer experiment timed out before completing.","timestamp":1776548616358,"segment":0,"confidence":2.557377049180328,"iterationTokens":2191,"asi":{"hypothesis":"Low-prompt-weight hints in agent command descriptions/help may teach the model the search-code -> get-file handoff without changing SKILL.md body text.","rollback_reason":"The experiment did not complete: R2 timed out at the inner 300s alarm and the outer run_experiment hit 900s before the harness finished.","next_action_hint":"Do not pursue help/spec wording blindly on the full harness. If exploring CLI affordances further, first switch to a dedicated R2 micro-harness or inspect whether the model even uses command help.","secondary_metrics":{"partial_r2_wall":300,"partial_r4_wall":369},"learned":"Tiny CLI description changes can still perturb sampled behavior dramatically, and the full subset harness is too expensive for high-variance blind exploration."}}
{"type":"config","name":"Reduce octocode-cli R2 library-usage benchmark gap","metricName":"r2_s","metricUnit":"s","bestDirection":"lower"}
{"run":15,"commit":"b107070","metric":0,"metrics":{},"status":"crash","description":"First R2-only micro-harness baseline timed out before producing metrics, so the slimmed script is not yet usable.","timestamp":1776551402499,"segment":1,"confidence":null,"iterationTokens":133,"asi":{"hypothesis":"Switching to a cheap R2+R3 micro-harness will let us explore R2-specific ideas without paying the full R2/R4/R5 cost every iteration.","rollback_reason":"The new micro-harness did not finish under run_experiment and emitted no metrics, so the baseline is invalid.","next_action_hint":"Inspect the script/output to find why the shortened harness still hung, fix the control flow, and rerun the baseline before trying any optimization changes.","secondary_metrics":{"timeout_seconds":700}}}
{"run":16,"commit":"689fe3f","metric":464,"metrics":{},"status":"keep","description":"Established a valid R2-only micro-harness baseline after fixing the wrapper setup so both octocode-cli and bench-cli commands resolve inside the benchmark sandbox.","timestamp":1776554712155,"segment":1,"confidence":null,"iterationTokens":2115,"asi":{"hypothesis":"A dedicated R2+R3 micro-harness will let us test R2-specific ideas cheaply before revalidating on the broader subset.","secondary_metrics":{"r3_s":23,"passes":2,"target_passes":1,"avg_turns":7,"eff_cost":56799.55},"learned":"The micro-harness only became valid once the sandbox exposed an actual `octocode-cli` executable; otherwise the agent fell into command-discovery detours. Baseline R2 is still very slow at 464s, so there is room for large wins.","next_action_hint":"Use this cheaper harness to test small R2-specific skill/CLI changes, then switch back to the broader target if a change meaningfully improves R2."}}
{"run":17,"commit":"ce47305","metric":42,"metrics":{},"status":"keep","description":"CLI+skill: added exact `matchLine` metadata to `githubGetFileContent` JSON results for match-string queries and updated the skill recipe to use it. This removed the R2 line-number confusion and collapsed the R2 micro-harness.","timestamp":1776555011293,"segment":1,"confidence":null,"iterationTokens":2950,"asi":{"hypothesis":"The remaining R2 spiral comes from `get-file --match-string` returning only excerpt startLine, forcing the model to guess the actual call line. Exposing the exact matched line should let the first batched read succeed.","secondary_metrics":{"r3_s":27,"passes":2,"target_passes":1,"avg_turns":6,"eff_cost":37749.05},"learned":"This is a real CLI ergonomics win, not benchmark cheating: the exact matched line is derivable from existing output and query input, and it made the agent stop retrying the same batch. R2 dropped from 464s to 42s on the micro-harness.","next_action_hint":"Now switch back to the broader R2/R4/R5 harness and revalidate this change under the original target before considering more micro-optimizations."}}
{"type":"config","name":"Reduce octocode-cli skill benchmark gap on R2/R4/R5","metricName":"total_s","metricUnit":"s","bestDirection":"lower"}
{"run":18,"commit":"342dd98","metric":82,"metrics":{},"status":"keep","description":"Revalidated the R2-focused CLI ergonomics change on the broader subset: exposing exact matchLine metadata for get-file match-string queries plus the skill update collapsed the full R2/R4/R5 benchmark.","timestamp":1776555213101,"segment":2,"confidence":null,"iterationTokens":146,"asi":{"hypothesis":"If the agent can read the exact matched line directly from get-file results, the R2 fix should carry over to the broader benchmark without hurting R4/R5.","secondary_metrics":{"r2_s":38,"r4_s":21,"r5_s":23,"r3_s":999,"passes":3,"target_passes":3,"avg_turns":4.5,"eff_cost":35632.2},"learned":"The improvement generalizes strongly: total_s fell from the prior best sampled 156s to 82s, with all three target tasks speeding up and target passes staying perfect. The flaky R3 scorer still should not block keeps.","next_action_hint":"This is likely the new main branch best. Next steps should be noise-check reruns and only then very small follow-ups, because the obvious bottleneck is now gone."}}
{"run":19,"commit":"342dd98","metric":142,"metrics":{},"status":"discard","description":"Noise-check rerun of the current best matchLine branch; R2 and R5 stayed fast, but R4 varied upward enough that this sample did not beat the retained best 82s run.","timestamp":1776555393987,"segment":2,"confidence":null,"iterationTokens":919,"asi":{"hypothesis":"The new matchLine-based fix is real, but the subset benchmark may still have meaningful task-level variance, especially on R4.","rollback_reason":"This is the same code state and the rerun was slower than the best retained sample, so there is no new code to keep separately.","next_action_hint":"Treat the 82s result as the retained best and only pursue follow-ups with clear structural upside. If continuing, inspect the slow R4 transcript or do one more rerun to gauge variance.","secondary_metrics":{"r2_s":39,"r4_s":80,"r5_s":23,"r3_s":23,"passes":4,"target_passes":3,"avg_turns":6.25,"eff_cost":41646.975},"learned":"The fix clearly stabilized R2; remaining variance is now concentrated in R4 rather than the original search/read loop."}}
{"run":20,"commit":"342dd98","metric":220,"metrics":{},"status":"discard","description":"Skill-only follow-up: added a stronger local R4 instruction to answer immediately after the first usable path-filtered PR result and not retry alternate keyword queries, but the sampled benchmark regressed badly.","timestamp":1776555701173,"segment":2,"confidence":null,"iterationTokens":3588,"asi":{"hypothesis":"A narrowly targeted R4 note might suppress the remaining PR-query thrash without affecting the new R2 fix.","rollback_reason":"Overall total_s regressed from 82s to 220s; R4 still blew up and R5 worsened too.","next_action_hint":"Do not add more local prose. The major win is already the CLI matchLine affordance. Remaining variance is likely model noise or would need a real CLI feature such as local path-prefix filtering for search-prs.","secondary_metrics":{"r2_s":47,"r4_s":114,"r5_s":59,"r3_s":999,"passes":3,"target_passes":3,"avg_turns":11.75,"eff_cost":61025.475},"learned":"Even local prompt nudges can destabilize now-fast tasks. After the matchLine fix, further skill text is more likely to add noise than remove it."}}
