{"run":1,"commit":"485db5a","metric":0,"metrics":{},"status":"crash","description":"Tried to benchmark current working tree in ../coding-agents-plugins, but ./autoresearch.sh was not executable (permission denied).","timestamp":1776386354540,"segment":0,"confidence":null,"iterationTokens":null,"asi":{"hypothesis":"Use the existing harness to benchmark the current working tree before further optimization.","rollback_reason":"Benchmark command failed immediately because the harness lacks execute permission in this repo clone.","next_action_hint":"Invoke the harness via bash autoresearch.sh so experiments can proceed without changing file permissions.","error":"bash: ./autoresearch.sh: Permission denied"}}
{"type":"config","name":"Speed up octocode-cli help startup","metricName":"total_ms","metricUnit":"ms","bestDirection":"lower"}
{"run":2,"commit":"4f1c7f8","metric":613.193,"metrics":{},"status":"keep","description":"Baseline for built octocode-cli lightweight startup flows (--help, search-code --help, --version)","timestamp":1776386509616,"segment":1,"confidence":null,"iterationTokens":119,"asi":{"hypothesis":"Establish a baseline for representative built CLI help/version invocations before optimizing startup imports.","secondary_metrics":{"help_ms":203.97,"command_help_ms":181.953,"version_ms":227.269,"stdout_bytes":41535,"passes":1},"learned":"Even no-network help/version paths cost ~180-227ms each, suggesting startup/import overhead dominates more than command logic."}}
{"run":3,"commit":"b6ce7a1","metric":266.728,"metrics":{},"status":"keep","description":"Code-split the built CLI and lazy-load commands/tool/help modules so lightweight help/version flows avoid eager startup of the full command graph","timestamp":1776386605093,"segment":1,"confidence":null,"iterationTokens":5504,"asi":{"hypothesis":"The main entrypoint eagerly imports heavy command and tool modules; code splitting plus lazy imports should cut no-network startup time without changing output.","secondary_metrics":{"help_ms":39.769,"command_help_ms":192.438,"version_ms":34.521,"stdout_bytes":41535,"passes":1},"learned":"Single-file bundling was the dominant cost. Splitting shrank the entry bundle from ~2.8MB to ~4KB and made general help/version dramatically faster, while command-specific help remained dominated by loading the commands chunk."}}
{"run":4,"commit":"751e61b","metric":146.091,"metrics":{},"status":"keep","description":"Split agent subcommand metadata from heavy command handlers so search-code --help and agent command dispatch avoid loading the full commands chunk","timestamp":1776386786315,"segment":1,"confidence":3.8719629964272984,"iterationTokens":15619,"asi":{"hypothesis":"Agent subcommands should not need the full admin command registry just to print help or dispatch execution; a tiny metadata/spec chunk can serve those paths.","secondary_metrics":{"help_ms":55.395,"command_help_ms":46.196,"version_ms":44.5,"stdout_bytes":41535,"passes":1},"learned":"`search-code --help` was mostly paying for loading `commands.ts`. Moving agent command specs into their own small chunk cut command-help latency by ~4x, and overall startup fell to ~146ms total."}}
{"run":5,"commit":"4e31d6f","metric":130.447,"metrics":{},"status":"keep","description":"Stop preloading agent subcommand metadata on every invocation by keeping the agent-name fast path local and only importing specs when needed","timestamp":1776386844219,"segment":1,"confidence":7.084567914823049,"iterationTokens":3144,"asi":{"hypothesis":"Even a tiny shared metadata chunk can add avoidable startup overhead when it becomes a hard dependency of the entrypoint.","secondary_metrics":{"help_ms":42.203,"command_help_ms":41.142,"version_ms":47.101,"stdout_bytes":41535,"passes":1},"learned":"Removing the eager shared agent-spec dependency shaved another ~16ms total and brought general help back near the earlier low-latency result while preserving fast agent command help."}}
{"run":6,"commit":"4e31d6f","metric":451.298,"metrics":{},"status":"discard","description":"Tried replacing the shared colors import in src/index.ts with a local dim helper to avoid one startup dependency, but runtime regressed badly","timestamp":1776386898429,"segment":1,"confidence":3.5422839574115246,"iterationTokens":6574,"asi":{"hypothesis":"Eliminating a tiny shared colors chunk from the entrypoint might shave a bit more startup overhead.","rollback_reason":"The bundle shape changed in a way that materially regressed all benchmarked paths, so this is not a profitable micro-optimization.","next_action_hint":"Keep the split/lazy-loading architecture and avoid touching tiny shared utilities unless bundle output shows a concrete startup win.","secondary_metrics":{"help_ms":170.677,"command_help_ms":151.924,"version_ms":128.698,"stdout_bytes":41535,"passes":1},"learned":"Seemingly small source edits can perturb esbuild chunking enough to destroy the startup gains; inspect the emitted graph before retrying low-level bundle tweaks."}}
{"run":7,"commit":"4e31d6f","metric":144.837,"metrics":{},"status":"discard","description":"Tried top-level argv preflight in src/index.ts to short-circuit pure --help/--version before loading cli/index, but it did not beat the current best","timestamp":1776386951951,"segment":1,"confidence":7.0199730977569335,"iterationTokens":2734,"asi":{"hypothesis":"A tiny entrypoint preflight for bare --help/--version could avoid loading parser/CLI glue and improve startup further.","rollback_reason":"The extra branching and alternate entry flow underperformed the current best total_ms, so it is not worth keeping.","next_action_hint":"Treat the current ~130ms result as near the floor unless a larger structural change appears; avoid more top-level micro-routing tweaks.","secondary_metrics":{"help_ms":47.985,"command_help_ms":50.233,"version_ms":46.618,"stdout_bytes":41535,"passes":1},"learned":"After code splitting, top-level routing overhead is already small; additional preflight logic mostly adds noise and branch cost instead of removing meaningful work."}}
{"run":8,"commit":"1662e81","metric":118.756,"metrics":{},"status":"keep","description":"Render help output with one buffered stdout write per screen instead of many console.log calls, preserving text while cutting help and version wall time","timestamp":1776387027463,"segment":1,"confidence":18.08805560636546,"iterationTokens":5542,"asi":{"hypothesis":"Help rendering may still spend measurable time in many small console writes; emitting each screen as one buffered write could reduce startup overhead without changing content.","secondary_metrics":{"help_ms":39.882,"command_help_ms":39.92,"version_ms":38.954,"stdout_bytes":41535,"passes":1},"learned":"For this CLI, one write per rendered help screen beats many console.log calls. It improved all measured paths and brought total startup to ~119ms."}}
{"run":9,"commit":"1662e81","metric":166.946,"metrics":{},"status":"discard","description":"Tried swapping version output from console.log to process.stdout.write, but it regressed all measured startup paths","timestamp":1776387057238,"segment":1,"confidence":15.49133690509759,"iterationTokens":1234,"asi":{"hypothesis":"The tiny version path might benefit from bypassing console.log and writing directly to stdout.","rollback_reason":"This changed the bundle/runtime shape in a way that materially worsened performance, so the direct-write version path is not worth keeping.","next_action_hint":"Keep the buffered help rendering win but leave the standalone version print on console.log.","secondary_metrics":{"help_ms":56.41,"command_help_ms":58.463,"version_ms":52.074,"stdout_bytes":41535,"passes":1},"learned":"Even tiny output-path tweaks can perturb bundle chunking enough to swamp their theoretical micro-benefit; benchmark after every small change."}}
{"run":10,"commit":"1662e81","metric":127.835,"metrics":{},"status":"discard","description":"Re-ran the current best branch to sample noise; result stayed far better than baseline but above the best observed 118.756ms","timestamp":1776387073387,"segment":1,"confidence":23.70831934787822,"iterationTokens":783,"asi":{"hypothesis":"Measure variance on the current best branch before attempting more risky structural changes.","rollback_reason":"This rerun was slower than the best observed metric, so keep the earlier better sample as the retained baseline for this code state.","next_action_hint":"Further wins likely require larger design changes (for example splitting admin command metadata), not more micro-tuning on the current help path.","secondary_metrics":{"help_ms":42.753,"command_help_ms":44.515,"version_ms":40.568,"stdout_bytes":41535,"passes":1},"learned":"Current best-state noise appears to be on the order of ~9ms total, with all three sub-measures remaining tightly clustered well below the original baseline."}}
{"run":11,"commit":"1662e81","metric":405.875,"metrics":{},"status":"discard","description":"Tried giving agent subcommands their own direct help renderer to avoid importing help.ts for search-code --help, but the emitted chunk graph regressed startup badly","timestamp":1776387206187,"segment":1,"confidence":14.882370646841036,"iterationTokens":783,"asi":{"hypothesis":"Agent command help might be faster if it can render directly from the tiny specs module instead of also loading the shared help renderer chunk.","rollback_reason":"The bundle shape changed in a way that heavily regressed all measured paths, overwhelming any saved import on the agent-help path.","next_action_hint":"Avoid duplicating help-rendering logic across chunks; shared rendering appears to help esbuild produce a better startup graph here.","secondary_metrics":{"help_ms":141.803,"command_help_ms":125.545,"version_ms":138.527,"stdout_bytes":41535,"passes":1},"learned":"Trying to optimize a single import edge can backfire when it de-duplicates less code across chunks; the chunk graph matters more than the source-level intuition."}}
{"run":12,"commit":"1662e81","metric":194.29,"metrics":{},"status":"discard","description":"Tried trimming unused version code from help.ts to shrink the help chunk slightly, but startup regressed despite the smaller output","timestamp":1776387250652,"segment":1,"confidence":12.641891028099511,"iterationTokens":1916,"asi":{"hypothesis":"Removing dead version-export code from the shared help chunk might reduce parse/load work on help paths.","rollback_reason":"Even with a slightly smaller help chunk, measured startup got substantially worse, so this source-level cleanup is not a real runtime win here.","next_action_hint":"Do not assume smaller emitted files mean faster startup; validate chunk graph/runtime behavior, not just byte size.","secondary_metrics":{"help_ms":62.166,"command_help_ms":64.29,"version_ms":67.834,"stdout_bytes":41535,"passes":1},"learned":"This benchmark is highly sensitive to emitted bundle shape. Small code removals can still worsen startup, so byte-count reductions are not a reliable proxy for cold-run speed."}}
{"run":13,"commit":"1662e81","metric":296.641,"metrics":{},"status":"discard","description":"Tried a raw-argv fast path inside runCLI for bare --help/--version to skip parseArgs, but it regressed the emitted bundle and startup time","timestamp":1776387297799,"segment":1,"confidence":8.625530986959745,"iterationTokens":2672,"asi":{"hypothesis":"A minimal pre-parse check inside runCLI could shave help/version latency without the chunking downsides of an index-level preflight.","rollback_reason":"The resulting bundle/runtime shape regressed all measured paths, so the fast path is not worth keeping.","next_action_hint":"Avoid more pre-parse routing tweaks; the remaining headroom likely needs a different structural lever than bypassing parseArgs.","secondary_metrics":{"help_ms":80.49,"command_help_ms":120.936,"version_ms":95.215,"stdout_bytes":41535,"passes":1},"learned":"Even localized fast paths in cli/index.ts can destabilize the optimized split-bundle layout enough to erase their intended benefits."}}
{"run":14,"commit":"1662e81","metric":138.948,"metrics":{},"status":"discard","description":"Tried fully lazy-loading parser.ts and short-circuiting bare --help/--version/no-args before parsing, but it still underperformed the current best branch","timestamp":1776387349542,"segment":1,"confidence":12.641891028099511,"iterationTokens":2193,"asi":{"hypothesis":"Moving parser code out of the entry chunk should reduce lightweight startup overhead enough to offset one extra dynamic import on parsed flows.","rollback_reason":"The split-parser variant remained slower than the current best total_ms, so the added indirection is not paying for itself on this benchmark.","next_action_hint":"Parser splitting is probably not worthwhile for this workload; focus only on larger structural wins or stop if remaining headroom is below noise.","secondary_metrics":{"help_ms":46.573,"command_help_ms":46.83,"version_ms":45.545,"stdout_bytes":41535,"passes":1},"learned":"The current main chunk is already close to the startup floor. Further import-splitting can add more loader overhead than it removes."}}
{"run":15,"commit":"1662e81","metric":146.882,"metrics":{},"status":"discard","description":"Tried precomputing the top-level help text as one module-scope constant instead of building the array inside showHelp, but runtime regressed","timestamp":1776387429657,"segment":1,"confidence":14.880355127529908,"iterationTokens":4366,"asi":{"hypothesis":"Hoisting the static help text construction to module scope might reduce per-call work on the general help path without changing output.","rollback_reason":"Module-scope precomputation made the imported help chunk slower overall, so the current on-call construction is better for this benchmark.","next_action_hint":"Treat the buffered-help implementation as the better local optimum; avoid hoisting more work into module initialization.","secondary_metrics":{"help_ms":47.936,"command_help_ms":50.197,"version_ms":48.749,"stdout_bytes":41535,"passes":1},"learned":"For these short-lived CLI processes, shifting work from function execution into module initialization can hurt more than it helps because import-time cost dominates."}}
{"type":"config","name":"Speed up octocode-cli help startup (agent + admin)","metricName":"total_ms","metricUnit":"ms","bestDirection":"lower"}
{"run":16,"commit":"c5f419e","metric":491.371,"metrics":{},"status":"keep","description":"Baseline for broader built octocode-cli help workload including general help, agent help, admin help, and version","timestamp":1776387515607,"segment":2,"confidence":null,"iterationTokens":104,"asi":{"hypothesis":"Broaden the workload to include admin command help so we do not overfit only to agent help/version paths.","secondary_metrics":{"help_ms":56.13,"agent_help_ms":56.01,"admin_help_ms":316.921,"version_ms":62.31,"stdout_bytes":46683,"passes":1},"learned":"`install --help` is by far the dominant remaining cost on the broader workload, confirming admin help dispatch through `commands.ts` is the next high-leverage target."}}
{"run":17,"commit":"2e59029","metric":439.921,"metrics":{},"status":"keep","description":"Add a lightweight static help-spec path for install/setup so admin command help avoids loading the heavy commands.ts registry on --help","timestamp":1776387580185,"segment":2,"confidence":null,"iterationTokens":3747,"asi":{"hypothesis":"`install --help` should not need the full commands.ts graph; a tiny metadata module for static help can cut the dominant admin-help cost.","secondary_metrics":{"help_ms":47.485,"agent_help_ms":47.119,"admin_help_ms":300.786,"version_ms":44.532,"stdout_bytes":46683,"passes":1},"learned":"A small static help-spec chunk improved the broader workload by ~10% and shaved about 16ms off the median `install --help` path without changing output. The remaining bottleneck is still admin help, so extending this pattern to more commands is promising."}}
{"run":18,"commit":"2e59029","metric":445.203,"metrics":{},"status":"discard","description":"Noise-check rerun of the install static-help branch; still much better than baseline but above the best observed sample","timestamp":1776387604201,"segment":2,"confidence":9.740628549791776,"iterationTokens":1092,"asi":{"hypothesis":"Sample variance on the broadened workload after the static install-help optimization.","rollback_reason":"This rerun was slower than the best observed metric for the same code state, so keep the earlier better sample as the retained result.","next_action_hint":"If continuing, extend the static-help pattern to other admin commands or broaden the workload again; the current install-help path remains the main hotspot.","secondary_metrics":{"help_ms":53.661,"agent_help_ms":52.343,"admin_help_ms":293.472,"version_ms":45.728,"stdout_bytes":46683,"passes":1},"learned":"The optimized broader workload appears to vary by only a few milliseconds around ~440-445ms total, with admin help still dominating the residual cost."}}
{"type":"config","name":"Speed up octocode-cli help startup (agent + multi-admin)","metricName":"total_ms","metricUnit":"ms","bestDirection":"lower"}
{"run":19,"commit":"76fe305","metric":5901.393,"metrics":{},"status":"keep","description":"Baseline for widened help workload including general help, agent help, six admin command help paths, and version","timestamp":1776387780627,"segment":3,"confidence":null,"iterationTokens":105,"asi":{"hypothesis":"Broaden the workload again so multi-command admin help optimizations are measured directly instead of overfitting to install --help.","secondary_metrics":{"help_ms":182.399,"agent_help_ms":150.023,"install_help_ms":1531.234,"skills_help_ms":1159.036,"sync_help_ms":798.295,"mcp_help_ms":767.996,"token_help_ms":686.343,"cache_help_ms":539.216,"version_ms":86.851,"stdout_bytes":61698,"passes":1},"learned":"Admin command help dominates the honest multi-command workload by a huge margin, with install/skills/sync/mcp/token/cache each paying hundreds of milliseconds to load the full commands graph."}}
{"run":20,"commit":"604ab8e","metric":4584.782,"metrics":{},"status":"keep","description":"Extend the static help-spec path from install to skills, sync, mcp, token, and cache so multiple admin help flows avoid loading the heavy commands.ts registry","timestamp":1776387898223,"segment":3,"confidence":null,"iterationTokens":3710,"asi":{"hypothesis":"Most admin `--help` paths only need static metadata, so serving them from a lightweight help-spec module should cut the dominant multi-admin startup cost.","secondary_metrics":{"help_ms":107.654,"agent_help_ms":115.43,"install_help_ms":1395.487,"skills_help_ms":660.556,"sync_help_ms":609.806,"mcp_help_ms":554.804,"token_help_ms":556.357,"cache_help_ms":491.702,"version_ms":92.985,"stdout_bytes":61698,"passes":1},"learned":"The static-help pattern generalizes well: the widened workload improved by ~22%, with the largest wins on skills/sync/mcp/token help while preserving output. Admin help is still the main bottleneck, but much less so than baseline."}}
{"run":21,"commit":"72ed903","metric":344.475,"metrics":{},"status":"keep","description":"Let static admin help render directly from the lightweight command-help chunk so install/skills/sync/mcp/token/cache --help avoid importing help.ts and commands.ts entirely","timestamp":1776388014233,"segment":3,"confidence":4.220622492140807,"iterationTokens":6961,"asi":{"hypothesis":"The multi-admin workload still pays unnecessary `help.ts` import cost on static help paths; rendering directly from the lightweight static-help chunk should collapse those paths further.","secondary_metrics":{"help_ms":37.933,"agent_help_ms":36.109,"install_help_ms":37.032,"skills_help_ms":36.304,"sync_help_ms":36.244,"mcp_help_ms":36.981,"token_help_ms":43.136,"cache_help_ms":41.871,"version_ms":38.866,"stdout_bytes":61698,"passes":1},"learned":"This was the key remaining win: once static admin help stopped importing both `commands.ts` and `help.ts`, the entire widened workload dropped by ~94% vs baseline and all admin help paths converged near 36-43ms."}}
{"run":22,"commit":"72ed903","metric":318.565,"metrics":{},"status":"discard","description":"Noise-check rerun of the current best static-admin-help branch; same code came in faster, confirming the new floor is around the low-300ms range","timestamp":1776388047765,"segment":3,"confidence":2.6050798634949883,"iterationTokens":1399,"asi":{"hypothesis":"Re-sample the current best branch to estimate variance after the major static-help win.","rollback_reason":"There is no new code change to keep separately; this run just refines our understanding of noise on the current best implementation.","next_action_hint":"Remaining gains are likely small and may require either broadening the workload again or stopping once no structural wins remain.","secondary_metrics":{"help_ms":35.239,"agent_help_ms":35.628,"install_help_ms":34.894,"skills_help_ms":36.611,"sync_help_ms":35.452,"mcp_help_ms":35.843,"token_help_ms":34.383,"cache_help_ms":34.525,"version_ms":35.99,"stdout_bytes":61698,"passes":1},"learned":"The optimized branch is stable and much faster than baseline; all measured paths now cluster tightly around ~34-36ms except small noise on a few runs."}}
