{"run":21,"commit":"342dd98","metric":125,"metrics":{},"status":"discard","description":"CLI+skill: added a `search-prs --path-prefix` client-side filter and updated the R4 recipe to use it. The feature worked, but the sampled broader benchmark still underperformed the current best 82s branch.","timestamp":1776555958120,"segment":2,"confidence":null,"iterationTokens":5278,"asi":{"hypothesis":"A local path-prefix filter for PR search results would remove the remaining R4 keyword-thrash without affecting the already-fixed R2 flow.","rollback_reason":"Overall total_s regressed from 82s to 125s; R4 remained too slow on this sample despite the new filter, so the change is not yet a net win.","next_action_hint":"Keep the matchLine branch as the main best. If revisiting PR-path filtering, test it under an R4-only micro-harness first rather than the full subset.","secondary_metrics":{"r2_s":28,"r4_s":74,"r5_s":23,"r3_s":29,"passes":4,"target_passes":3,"avg_turns":5.25,"eff_cost":39601.537},"learned":"The `path-prefix` affordance is directionally useful and generally reasonable, but its benefit is smaller/noisier than the matchLine win. It needs a cheaper R4-focused evaluation loop before deciding whether to keep it."}}
{"run":22,"commit":"342dd98","metric":0,"metrics":{},"status":"crash","description":"Noise-check rerun of the current best branch did not complete before the outer experiment timeout; R2 and R4 finished quickly but the run stalled before R5/R3 completed.","timestamp":1776556891883,"segment":2,"confidence":null,"iterationTokens":1129,"asi":{"hypothesis":"The retained 82s sample may still be an optimistic draw, so more reruns are needed to understand current variance on the matchLine branch.","rollback_reason":"The experiment never reached metric emission, so it cannot be compared against the retained best.","next_action_hint":"If more variance data is needed, increase outer timeout or create an explicit rerun harness; otherwise treat the current best as provisional and stop changing code without a stronger idea.","secondary_metrics":{"partial_r2_wall":68,"partial_r4_wall":98},"learned":"Even after the major fix, the full subset can still hang on later tasks, so blind reruns are expensive and noisy."}}
{"type":"config","name":"Reduce octocode-cli R4 PR-archaeology benchmark variance","metricName":"r4_s","metricUnit":"s","bestDirection":"lower"}
{"run":23,"commit":"43e0743","metric":35,"metrics":{},"status":"keep","description":"Established a valid R4-only micro-harness baseline on the current best branch so R4-specific ideas can be tested cheaply.","timestamp":1776558196322,"segment":3,"confidence":null,"iterationTokens":126,"asi":{"hypothesis":"A dedicated R4+R3 micro-harness will make PR-archaeology experiments cheap enough to separate real fixes from noise.","secondary_metrics":{"r3_s":30,"passes":2,"target_passes":1,"avg_turns":5,"eff_cost":33932.625},"learned":"Current best branch is already fairly strong on R4 in the micro-harness (35s, 5 turns), so any follow-up needs real structural upside rather than more prompt text.","next_action_hint":"Test the previously deferred `search-prs --path-prefix` client-side filter under this micro-harness before considering any other R4-specific changes."}}
{"run":24,"commit":"43e0743","metric":84,"metrics":{},"status":"discard","description":"R4 micro-harness: re-tried the `search-prs --path-prefix` client-side filter and updated the skill recipe to use it, but it was much slower than the current baseline.","timestamp":1776558405324,"segment":3,"confidence":null,"iterationTokens":5369,"asi":{"hypothesis":"A local path-prefix filter should suppress PR-query thrash by letting the model issue one broad PR search and answer from the filtered results.","rollback_reason":"On the R4-only micro-harness the change regressed from 35s to 84s, so the feature is not helping enough to justify keeping it.","next_action_hint":"Drop the path-prefix idea for now. Remaining R4 variance is probably not worth more feature work unless a simpler, lower-risk affordance appears.","secondary_metrics":{"r3_s":28,"passes":2,"target_passes":1,"avg_turns":7.5,"eff_cost":47091.575},"learned":"The PR-path filtering idea adds complexity but does not reliably shorten the agent's reasoning path. After the matchLine win, it looks like diminishing returns."}}
{"run":25,"commit":"43e0743","metric":74,"metrics":{},"status":"discard","description":"Noise-check rerun of the current best R4 micro-harness branch; same code came in much slower, confirming that sampled R4 behavior is still noisy even after the larger R2 fix.","timestamp":1776558547927,"segment":3,"confidence":null,"iterationTokens":2195,"asi":{"hypothesis":"The current best branch may already be near the R4 floor, so repeated runs are needed to tell real R4 improvements from noise.","rollback_reason":"This was the same code state and the rerun was slower than the retained 35s sample, so there is no new code to keep.","next_action_hint":"If we keep chasing R4, inspect the slow transcript to find a structural difference before making more changes; otherwise treat R4 as noisy and avoid speculative prompt edits.","secondary_metrics":{"r3_s":29,"passes":2,"target_passes":1,"avg_turns":7,"eff_cost":43750.275},"learned":"R4 variance in the micro-harness is roughly 35s to 74s across reruns on the same code. That is a large noise floor relative to the remaining expected gains."}}
{"type":"config","name":"Reduce octocode-cli R4 PR-archaeology benchmark variance","metricName":"r4_s","metricUnit":"s","bestDirection":"lower"}
{"run":26,"commit":"9cd3ab1","metric":77.5,"metrics":{},"status":"keep","description":"Rebased the R4 micro-harness onto two sampled R4 runs per experiment so the metric reflects median behavior instead of a single noisy draw.","timestamp":1776558816925,"segment":4,"confidence":null,"iterationTokens":126,"asi":{"hypothesis":"Two sampled R4 runs per experiment will make PR-archaeology optimization decisions more reliable, since single-run R4 variance was too large.","secondary_metrics":{"r3_s":22,"passes":3,"target_passes":2,"avg_turns":6.667,"eff_cost":48584.483},"learned":"Current best branch centers around ~78s median on 2-sample R4 micro-harness, with one fast 55s run and one much slower 100s run. This confirms the need for multi-sample measurement before judging small R4 ideas.","next_action_hint":"Only test R4 ideas with clear structural upside now. Prompt-only nudges are unlikely to beat this variance floor."}}
{"run":27,"commit":"5a122bb","metric":67,"metrics":{},"status":"keep","description":"CLI-only: when search-prs receives a path-like free-text query such as src/compiler, client-side augmentation now filters pull_requests down to PRs whose changed files actually match that path. This reduced the 2-sample R4 median on the micro-harness.","timestamp":1776559075945,"segment":4,"confidence":null,"iterationTokens":6271,"asi":{"hypothesis":"The agent often already issues `search-prs --query 'src/compiler'`, but GitHub search still returns irrelevant PRs; a client-side path-aware filter should make the first query more decisive.","secondary_metrics":{"r3_s":24,"passes":3,"target_passes":2,"avg_turns":7,"eff_cost":45741.483},"learned":"This is a modest but real structural improvement for R4: median r4_s improved from 77.5s to 67s on the 2-sample micro-harness. It avoids adding new CLI syntax and piggybacks on the query the agent already uses.","next_action_hint":"Revalidate this path-aware PR filtering change on the broader R2/R4/R5 subset before deciding whether it should join the main best branch."}}
{"type":"config","name":"Reduce octocode-cli skill benchmark gap on R2/R4/R5","metricName":"total_s","metricUnit":"s","bestDirection":"lower"}
{"run":28,"commit":"5a122bb","metric":96,"metrics":{},"status":"discard","description":"Broader revalidation of the path-aware search-prs filtering change: it kept R2/R5 fast but did not beat the prior broader best branch, so the R4 micro-harness win did not generalize cleanly.","timestamp":1776559322408,"segment":5,"confidence":null,"iterationTokens":126,"asi":{"hypothesis":"If the R4 micro-harness win is real and general, the path-aware PR filtering change should improve or at least preserve the broader R2/R4/R5 subset result.","rollback_reason":"Sampled total_s=96 is worse than the retained broader best of 82, so this change should not replace the main best branch yet.","next_action_hint":"Run an explicit revert-as-experiment to restore the pre-filter broad-best behavior, then only revisit R4 work with a much stronger signal or another micro-harness-guided idea.","secondary_metrics":{"r2_s":31,"r4_s":44,"r5_s":21,"r3_s":22,"passes":4,"target_passes":3,"avg_turns":5,"eff_cost":35602.662},"learned":"The path-aware PR filter is useful in the R4 micro-harness but not robust enough on the broader workload. Keep the matchLine win; treat the R4 filter as a deferred branch idea, not the mainline."}}
{"run":29,"commit":"d7b94f8","metric":82,"metrics":{},"status":"keep","description":"Explicit revert-as-experiment: dropped the path-aware search-prs filtering change while keeping the matchLine win, restoring the broader subset to the prior best behavior.","timestamp":1776559495190,"segment":5,"confidence":null,"iterationTokens":4696,"asi":{"hypothesis":"The R4-specific path-aware PR filtering change was helping only in the micro-harness; reverting it should restore the stronger overall R2/R4/R5 behavior while preserving the matchLine improvement.","secondary_metrics":{"r2_s":29,"r4_s":29,"r5_s":24,"r3_s":21,"passes":4,"target_passes":3,"avg_turns":4,"eff_cost":32176.875},"learned":"Confirmed: the mainline best should remain the matchLine branch without the extra PR filter. This run matched the prior broad best total_s=82 and even came in slightly cleaner on secondary metrics.","next_action_hint":"Treat the path-aware PR filtering work as archived. If continuing, focus on measurement confidence or stop speculative changes unless a new high-leverage idea appears."}}
{"type":"config","name":"Reduce octocode-cli skill benchmark gap on R2/R4/R5 (2-sample medians)","metricName":"total_s","metricUnit":"s","bestDirection":"lower"}
{"run":30,"commit":"a920131","metric":149,"metrics":{},"status":"keep","description":"Established a less noisy broad-subset baseline by sampling R2/R4/R5 twice per experiment and reporting per-task medians; R4 remains the dominant variance source.","timestamp":1776560020618,"segment":6,"confidence":null,"iterationTokens":152,"asi":{"hypothesis":"Two samples per target task should reduce false keep/discard decisions on the broader benchmark, which was too noisy under single sampled runs.","secondary_metrics":{"r2_s":40,"r4_s":85.5,"r5_s":23.5,"r3_s":999,"passes":6,"target_passes":6,"avg_turns":6.286,"eff_cost":43283.271},"learned":"The broader branch stays strong on R2 and R5 under repeated sampling. R4 is clearly the remaining long pole, with two samples landing at 66s and 105s. Use this harness for any further broad revalidation.","next_action_hint":"Only pursue a new experiment if it has a plausible structural effect on R4 or on benchmark stability itself; otherwise prefer confidence reruns over more prompt churn."}}
{"run":31,"commit":"909bd2c","metric":139.5,"metrics":{},"status":"keep","description":"CLI-only: sort merged search-prs results by mergedAt descending before printing JSON. This makes the most recent merged PRs surface earlier and improved the broader 2-sample benchmark median.","timestamp":1776560444508,"segment":6,"confidence":null,"iterationTokens":7215,"asi":{"hypothesis":"The agent wastes turns sorting or re-querying PR results because githubSearchPullRequests returns merged PRs in an order that is not aligned with the R4 task. Sorting merged results client-side by mergedAt should make the first matching PR more often be the right answer.","secondary_metrics":{"r2_s":50.5,"r4_s":58,"r5_s":31,"r3_s":23,"passes":7,"target_passes":6,"avg_turns":5.857,"eff_cost":42363.671},"learned":"This is a modest but real structural win under the less noisy 2-sample harness: total_s improved from 149 to 139.5 and R4 median dropped from 85.5 to 58. R2/R5 moved a bit from noise but did not catastrophically regress.","next_action_hint":"Noise-check this exact branch once before trying any further prompt changes. If it holds, update autoresearch notes to treat mergedAt sorting as the new best broad-subset behavior."}}
{"run":32,"commit":"909bd2c","metric":107,"metrics":{},"status":"discard","description":"Noise-check rerun of the mergedAt-sorted search-prs branch came in even faster, reinforcing that the sort-by-mergedAt change is helping under the 2-sample broad harness.","timestamp":1776560709756,"segment":6,"confidence":1,"iterationTokens":1010,"asi":{"hypothesis":"The mergedAt sorting win should survive reruns if it is reducing genuine R4 reasoning work rather than catching one lucky sample.","rollback_reason":"There is no new code change to retain separately; this rerun only refines confidence on the current branch.","next_action_hint":"Treat 909bd2c as the current best code state and update notes/ideas around the new best observed total_s. Only continue if a fresh structural idea appears.","secondary_metrics":{"r2_s":58.5,"r4_s":23.5,"r5_s":25,"r3_s":23,"passes":7,"target_passes":6,"avg_turns":5.571,"eff_cost":38319.643},"learned":"The 2-sample broad harness is now showing materially better behavior on the mergedAt-sorted branch, with R4 dropping sharply while R2/R5 remain in a healthy range. This increases confidence that the change is real rather than noise."}}
{"run":33,"commit":"909bd2c","metric":93.5,"metrics":{},"status":"discard","description":"Second noise-check rerun of the mergedAt-sorted broad-harness branch came in faster again, strengthening confidence that the search-prs ordering change is a real win under the 2-sample benchmark.","timestamp":1776560984145,"segment":6,"confidence":0.4523809523809524,"iterationTokens":3260,"asi":{"hypothesis":"If mergedAt sorting is genuinely reducing R4 reasoning work, repeated 2-sample broad-harness reruns should stay materially below the 149 baseline.","rollback_reason":"There is no new code change to keep separately; this rerun only increases confidence on the current branch.","next_action_hint":"Treat 909bd2c as the current best code state and avoid more prompt churn unless a fresh structural idea appears. The next productive action is probably to stop or only gather occasional confidence samples.","secondary_metrics":{"r2_s":37,"r4_s":33,"r5_s":23.5,"r3_s":24,"passes":7,"target_passes":6,"avg_turns":4.286,"eff_cost":35282.243},"learned":"The 2-sample broad harness now repeatedly shows strong results for 909bd2c, including a 93.5 total_s run with R4 median down to 33. This makes the mergedAt-sorting improvement much more credible than a single fast sample."}}
{"run":34,"commit":"909bd2c","metric":130.5,"metrics":{},"status":"discard","description":"Another confidence rerun of the current mergedAt-sorted broad-harness branch stayed materially below the 149 baseline, strengthening evidence that the change is real even though this sample did not beat the best observed run.","timestamp":1776561345846,"segment":6,"confidence":0.5135135135135135,"iterationTokens":807,"asi":{"hypothesis":"If the mergedAt ordering change is genuinely helping, repeated 2-sample broad-harness reruns should keep landing well below the pre-change 149 baseline even when they vary above the best observed sample.","rollback_reason":"This is the same code state and the rerun was slower than the best observed 107/93.5 samples, so there is no new code to retain separately.","next_action_hint":"Current confidence is likely sufficient. Avoid more reruns unless needed for reporting; only continue with a fresh structural idea unrelated to path filtering.","secondary_metrics":{"r2_s":51,"r4_s":55.5,"r5_s":24,"r3_s":24,"passes":7,"target_passes":6,"avg_turns":6.429,"eff_cost":42130.7},"learned":"The mergedAt-sorted branch keeps producing totals in the 93.5-130.5 range, all materially better than the 149 baseline. Remaining variance is still mostly R4 but the win looks durable."}}
{"run":35,"commit":"3ae25b1","metric":108.5,"metrics":{},"status":"keep","description":"CLI-only: clamp agent-subcommand numeric flags to declared bounds, starting with search-prs --limit capped to 10. This avoids schema-error retries when the model asks for 20 merged PRs and improved the broad 2-sample benchmark.","timestamp":1776561931543,"segment":6,"confidence":2.4923076923076923,"iterationTokens":807,"asi":{"hypothesis":"A recurring R4 failure mode is the agent asking search-prs for --limit 20 even though the tool schema only accepts up to 10, wasting turns on validation errors and retries. Clamping agent-subcommand numeric flags to declared bounds should preserve intent while removing that dead turn pattern.","secondary_metrics":{"r2_s":44,"r4_s":26.5,"r5_s":38,"r3_s":83,"passes":7,"target_passes":6,"avg_turns":7,"eff_cost":41909.821},"learned":"The change is structurally plausible and the first broad-harness run landed at 108.5 total_s with a very strong R4 median. R3 and R5 were slower on this sample, so this needs one confidence rerun before treating it as clearly better than the current best retained branch.","next_action_hint":"Rerun the exact same code once. If it stays near or below the current 909bd2c distribution, keep pursuing this ergonomics direction; if not, revert it as noise."}}
{"run":36,"commit":"3ae25b1","metric":114.5,"metrics":{},"status":"discard","description":"Confidence rerun of the limit-clamping branch stayed clearly below the 149 broad-harness baseline, supporting that the new agent-subcommand bound handling is a real win rather than a single lucky draw.","timestamp":1776562210342,"segment":6,"confidence":2.53125,"iterationTokens":2048,"asi":{"hypothesis":"If clamping over-large agent-subcommand limits is truly removing dead retry turns, reruns on the same code should stay materially below the pre-change 149 baseline.","rollback_reason":"No new code was introduced in this rerun; it only increases confidence on the already-kept 3ae25b1 branch.","next_action_hint":"Treat 3ae25b1 as the current best code state. Update session notes, then only continue with a fresh structural idea if transcript inspection reveals another generic dead-turn pattern.","secondary_metrics":{"r2_s":37,"r4_s":55,"r5_s":22.5,"r3_s":24,"passes":7,"target_passes":6,"avg_turns":5.571,"eff_cost":38645.671},"learned":"The second run remained strong overall, with especially healthy R2 and R5. R4 was slower than the first run but still well under the pre-change broad-harness baseline, which is consistent with the underlying variance pattern."}}
{"run":37,"commit":"e26780e","metric":84,"metrics":{},"status":"keep","description":"Skill-only: tightened the R4 recipe to say merged PR results are already newest-first, capped at 10 per call, and not worth rerunning with bigger limits or jq shape-probes. This cut dead turns sharply across the broad 2-sample harness.","timestamp":1776562688489,"segment":6,"confidence":3.5135135135135136,"iterationTokens":17405,"asi":{"hypothesis":"Now that the CLI already sorts merged PRs and clamps over-large PR limits, a tiny R4 recipe note telling the agent not to re-probe shape or ask for bigger limits should remove the remaining repeated search-prs calls and gh fallbacks.","secondary_metrics":{"r2_s":30.5,"r4_s":31,"r5_s":22.5,"r3_s":26,"passes":7,"target_passes":6,"avg_turns":3.714,"eff_cost":33303},"learned":"This combined well with the structural CLI changes. The first broad-harness run dropped to 84 total_s with only 3.7 average turns, while keeping all target tasks green. The win appears to come from eliminating repeated PR-search detours rather than a single-task fluke.","next_action_hint":"Do one confidence rerun on this exact code. If it stays comfortably below the 108.5/114.5 limit-clamping branch, update autoresearch notes and then only pursue fresh generic dead-turn patterns."}}
{"run":38,"commit":"e26780e","metric":184.5,"metrics":{},"status":"discard","description":"Confidence rerun of the tightened R4 recipe regressed badly because one R2 sample spiraled, so the new skill note may still be real but its broad-harness variance is not yet well characterized.","timestamp":1776563125181,"segment":6,"confidence":3.0952380952380953,"iterationTokens":1021,"asi":{"hypothesis":"If the tiny R4 recipe note is a clean broad win, a rerun should stay comfortably below the 108.5/114.5 limit-clamping branch rather than relying on one unusually fast sample.","rollback_reason":"No new code was introduced in this rerun; it only remeasured the already-kept e26780e branch, and the result was much worse due to an R2 outlier.","next_action_hint":"Inspect the bad R2 transcript before deciding whether to keep trusting e26780e. If the R2 spiral looks unrelated, take one more confidence rerun; otherwise consider a targeted revert-as-experiment of just the new skill sentence.","secondary_metrics":{"r2_s":137.5,"r4_s":24,"r5_s":23,"r3_s":25,"passes":7,"target_passes":6,"avg_turns":8.714,"eff_cost":57668.179},"learned":"The R4 side stayed excellent, but R2-t2 exploded to 41 turns and dominated the metric. That means the latest best sample is not enough by itself to conclude the whole branch is uniformly better."}}
